{
  "apiVersion": "qos-binding/v1",
  "kind": "CandidateCatalog",
  "metadata": {
    "name": "demo_01_simple_seq_catalog"
  },
  "spec": {
    "candidates": {
      "c1a": {
        "provides": "service/t1",
        "features": {
          "latency": 10
        }
      },
      "c1b": {
        "provides": "service/t1",
        "features": {
          "latency": 20
        }
      },
      "c2a": {
        "provides": "service/t2",
        "features": {
          "latency": 15
        }
      },
      "c3a": {
        "provides": "service/t3",
        "features": {
          "latency": 5
        }
      }
    },
    "featureBindings": {
      "latency": {
        "resource": "application",
        "id": "latency"
      }
    }
  }
}
